{
  "outcome": "passed",
  "reviewer": "Independent feature-verifier CLI fallback; requested GPT-6.1 Sol/medium, effective model/effort unconfirmed",
  "session": "01a1001b-6283-75f2-a9c7-5c1b60e89eba",
  "rationale": "Passed only the bounded keyboard correction at clean HEAD ba40c0caf1f780a21c806f4b38317148e69dbcc2 against base 282ddca. Inspected the complete three-file diff, including modes and absence of deletions/gitlink changes, actual UI/backend/service/composer entry points, approved requirements and constraints. Proposal, requirement and scope hashes match; all six submitted evidence hashes match. Installed backend/UI hashes match HEAD. Independent no-WM Xvfb reproduction: baseline fails native-focus deadline with unchanged target; candidate passes all ten journeys. A disposable control omitting modal present also fails with 103 missing-focus samples and unchanged target, confirming the wait does not convert missing focus into success. Native Return opens Review; Tab/Shift+Tab traverse choices; Enter activates the focused choice; No remains default. Escape on either choice, close, absent answer, refusal, refresh and relaunch retain no-write behavior. Keyboard and pointer Yes independently verify replacement bytes and preserved trailing bytes. Screenshots show visible selection and retained destructive-effect text. Submitted installed traces demonstrate delayed native focus before key delivery; KVM receipts show unchanged bytes for No and source-matching replacement for Yes. The original physical failure's unique cause remains unresolved after the owner's KVM/EDID correction. Admission, descriptor binding, serialization, bounded transfer, error/recovery wording and manual restart remain unchanged; historical source/document hashes verify, but old UI evidence does not certify this correction. Composer cache invalidation, capacity policy, dependencies, pins, masks, profiles and protections remain intact; all eight indexed gitlinks match the lock. No rebuilt composed image is certified: corrected UI is staged in existing SD /run. Hardware session/physical acceptance, actual eMMC durability/readback and normal boot remain pending and require their separate operation review. No hardware operation or release is authorized. Candidate remains clean; failures preserved in assigned scratch. Two diagnostic probes used about 23.3 seconds and 0.79 MiB.",
  "decision_sha256": "3753981dfb22ab49c9cd7dc03c7a11ecad0c13af0f4dd7910e4c47d3bf99135a",
  "evidence_sha256": "a681226e711c6564c71b1cc92118223859d08cde31452f60371f3dc9757999e3"
}