{
  "outcome": "passed",
  "reviewer": "feature_verifier_high / fresh full-role CLI fallback; GPT-6.1 Sol/high confirmed separately by coordinator",
  "session": "commissioning-environment-history-independent-verification-20261003-verify-env",
  "rationale": "Passed the bounded environment-history software repair at clean afee93824ec105906dea0bd2b13924fe38af451a, recorded base e5057bb900f6d910b340560e68207220b6b9cbb1. Reviewed the entire four-file diff (runtime/sv08_commissioning_health.py, tests/test_commissioning_host.py, docs/features/commissioning-host-readiness/software-contract.md, docs/features/commissioning-host-readiness/environment-repair.md). All 55 decision/proposal/requirement/scope/evidence/source/tool/unchanged-source/gitlink checks passed. Independently reproduced 18 actual ARM64 selected-tool regular-file cases and identical-fixture before/after: original admission refuses legitimate differing historical dictionaries; candidate admits exact selected/tool agreement. A1/A2 readback preserves original selected bytes and every selected non-counter value; A3 changes neither bank; six flag pairs cover orientations and wrap. Inspected source-bound final 18-test log and meaningful historical full Runtime/probe/run fixture negatives, including selected extra/missing/space mismatch, stale copying and preserved-bank mutation. Entire runtime except the admission method is unchanged: both-bank eligibility/CRC/selection, state/admission/writer locks, stable window, durable prewrite record, failures and same-boot refusal remain. This corrects a generated contract predicate and preserves all six approval constraints and owner access amendment. Earlier acceptance/evidence and failures remain historical; unchanged theme/112 regressions were traced, not rerun. No installed reconciliation, boot persistence, physical hardware profile, MCU or release is certified. Fresh exact-operation review and installed physical tasks remain separate and pending.",
  "decision_sha256": "f2891916b20c412c32e8031bcd09c032e1471368b4fb7de0be9d8c3886154eef",
  "evidence_sha256": "275787ede63f83a4159e2eeb88a9566f92792090b40e13a3eef4b1d520f5b259"
}
