{
  "outcome": "passed",
  "reviewer": "Fresh independent full-role feature_verifier CLI fallback; GPT-6.1 Sol/medium requested; effective runtime verification remains coordinator-owned",
  "session": "commissioning-host-installed-independent-delivery-20261004-final-review",
  "rationale": "Passed commissioning-host-readiness:installed (boots/access/sensors) at clean HEAD 35a69eedeb7aa5f223e299d5c7e91b17c3357df1. Complete 43-file diff from installed run base 586415e reviewed, including both independently high-verified repairs, retained failed/rejected observations and documentation. Full approved decision, proposal/requirement/scope and submitted document/source/receipt hashes agree; canonical digests bind all six constraints and the complete evidence list. Source comparison establishes runtime/scripts/tests/configs/UI/pins unchanged since accepted stable-device candidate 195dce6; valid software8504c46 and environment-repair afee938 evidence reused with explicit changed-source tracing, no broad tests rerun. Actual installed second normal restart and five-second HW667 cycle have distinct boot IDs, successful automatic A2-to-A3 replenishment, B0/A-only unchanged state/non-counter values, valid CRCs, immutable root/boot, writable data, seven masks/inactive services, persistent public SSH/TLS/marker and unchanged B/recovery hashes. First normal restart remains failed automatic health and is not counted healthy. Actual authenticated browser login/elevation/status/Stop/logout/relogin and branding persisted across both accepted transitions; stale authorization notice and unavailable image backend remain explicit. Reviewed current identify-only sequential bounded processes match both exact MCU identities, version/build and retained dictionary hash to the installed exact-pin host package/helper; input-only file-output parsing is offline on the installed host and configuration remains inactive. Exact installation/reconciliation/MCU/power action reviews and distinct runtime receipts inspected. Smartplug ON/statusON then OFF/statusOFF completed, serial ports closed, USB unchanged and same host boot/root/masks retained. Owner-reported host board revision does not establish physical MCU board identity, sensor accuracy/circuits/polarity, full binary/clock attestation, outputs, A/B qualification, printing, supported profile or release. Historical progress/current-goals text predates current receipts and awaits coordinator update; it does not override current acceptance. No hardware/network/credential/private-dump access, candidate edits, Git mutation, publication or agents. Coordinator must verify this fresh reviewer effective runtime before reliance. Explicit same-session evidence correction: the original list used directory profiles/test-sv08-01 and failed workflow public_path validation. Only the three profile fields now name the existing tracked file profiles/test-sv08-01/profile.json. All other evidence fields and bound source/document worktree and HEAD bytes remain unchanged. Original list/result/findings are preserved under before-profile-path filenames. Corrected canonical evidence digest replaces the original digest; boots/access/sensors scope and acceptance remain unchanged. Coordinator draft completion documents and pending record were excluded from this bounded correction review.",
  "decision_sha256": "f2891916b20c412c32e8031bcd09c032e1471368b4fb7de0be9d8c3886154eef",
  "evidence_sha256": "afe4cc8dd6293d8276e040e0e51a1f2d678f8e3aa60fdbc66647a874485d61af"
}
