{
  "outcome": "passed",
  "reviewer": "Independent full-role feature_verifier_high CLI fallback; GPT-6.1 Sol/high requested and coordinator-recorded, resumed runtime receipt coordinator-owned",
  "session": "commissioning-stable-device-independent-cli-20261003-verify-device-f1; same reviewer continuation after outer launcher timeout",
  "rationale": "Software repair verification only: clean candidate 195dce6e0c67fa9beec3de0a45308e54abf4f46b against base 0f563c7a5dfefe56f614281ec1c5b0dd18bdc318. Entire four-file diff and test/document-only F1 correction reviewed; full approved decision/proposal/owner amendment, document/source Git blobs, requirement/scope hashes and indexed pins match. Independently reproduced full focused suite: 17 pass, one explicit unchanged selected-tool opt-in skip, 10.722 seconds. F1 closed: original and alternate resolve to valid mocked whole block devices; alternate positively passes devices(); distinct stable-window, within-probe and post-write identity reasons asserted with zero/zero/one writes, failed-or-unknown records and same-boot retry refusal. Historical dependency/GPT path and positive node/dev_t renumbering executed. Parent trace did not capture historical child branch hits; no branch-coverage or mutation result claimed. Unchanged runtime/stager/unit inspected for identity/parser/tool/locks/deadlines/retention integration. Prior actual ARM64 18-case alias-backed regular-file evidence reused only for unchanged selected-tool class AST and runtime; prior inadequate retarget evidence is not accepted. Historical transcript digest matches its exact recorded prefix, not appended whole file; obsolete source_revision/test hashes are historical and superseded by current source-bound submission. All six constraints remain binding. One auxiliary experiment consumed; no further diagnostic or passing-test rerun during authorized same-session continuation. Exact generated-data total was not instrumented. Installed acceptance, installed helper/dependency hash agreement and separate exact-action review remain pending; read-only candidate devices/environment did not prove installed helper run or prepatch hash agreement. No hardware/profile/release acceptance or action authority, no owner requirement waiver. See findings.md and hash-audit.json for evidence limits and accounting.",
  "decision_sha256": "f2891916b20c412c32e8031bcd09c032e1471368b4fb7de0be9d8c3886154eef",
  "evidence_sha256": "21559335f37288e0fee3863a8f88dabc873ba89d508fcc2aab5350d30474a81d"
}
