{
  "outcome": "failed",
  "reviewer": "Independent full-role fallback reviewer; effective model/effort not independently confirmed",
  "session": "printer-theme-20261004-feature-verifier",
  "rationale": "FAIL: evidence provenance remains insufficient for acceptance of 69d660b. Complete 2661cc6..69d660b diff contains only ui/printer/index.html, ui/printer/style.css and docs/features/printer-component-configuration/theme-correction.md; worktree remained clean. HTML identifiers, control attributes, script tags, app.js and session.js are unchanged. Host CSS baseline matches. Checked ui/host/style.css, the approval record/proposal/requirements, visual.mjs, visual-r1/result.json, theme-1440.png, theme-1024.png, theme-390.png and dialog-mobile.png under local/feature-workflow/probes/printer-theme-20261004/. Screenshots show the requested branding and visible dialog focus; no styling defect identified. However, submitted visual results lack source_commit and source/artifact hashes. Existing software evidence hashes match their historical commit, but do not bind the changed visual files at HEAD. Fix: provide a verifiable candidate-bound visual receipt with source and screenshot hashes, commands/environment and reproducible before/after evidence; retain viewport, overflow, keyboard and cancellation checks. Two independent diagnostic attempts failed before assertions because of reviewer harness issues; allowance exhausted. Logs/provenance are in /home/drew/sv08-mainline/local/feature-workflow/probes/printer-theme-20261004/feature-verifier/. No broad browser, installed, hardware or release pass claimed. evidence_sha256 hashes the existing record's six-item software evidence list; no correction-specific evidence list was supplied.",
  "decision_sha256": "a3da77de13fccb18617a342544f770acec730263a3391769c8148ad1e3e4318d",
  "evidence_sha256": "cec6d224532e1e550dad99e3932c9fbc6c05892d597caeeb244d19addab64c72"
}
